"complaint","department"
"construction debris has been left on the road near the corner shop area since this afternoon.","Roads"
"Could you please look into the issue that construction debris has been left on the road near Nehru Colony for 2 weeks now?","Roads"
"the drainage near the railway station road has been overflowing for several days.","Drainage"
"stray dogs near the hospital in the corner shop area are becoming a health hazard. This has been a recurring issue in the area and is causing a lot of inconvenience to residents. Please take strict action against those responsible.","Health"
"Could you please look into the issue that traffic congestion near the slum area has become unbearable? Regards.","Transport"
"I feel helpless because an electric pole near the school area is damaged and leaning dangerously. Please take strict action against those responsible","Electricity"
"there is a SHORTAGE of medical staff at the clinic near the temple area. This has been a recurring issue in the area and is causing a lot of inconvenience to residents. Please look into this matter as soon as possible.","Health"
"Kindly note that mosquito control measures have not been taken near the school area for 2 weeks now. Please look into this matter as soon as possible.","Health"
"the bus conductor near the local market was rude to passengers.","Transport"
"Sir just want to say loose electric wires are hanging near the residential BLOCK, posing a safety risk. Waiting for a quick response from your side.","Electricity"
"a theft was reported near the bridge area and no action has been taken.","Police"
"the electricty bill for our village shows incorrect meter reading. This has been a recurring issue in the area and is causing a lot of inconvenience to residents. We need a permanent solution to this problem.","Electricity"
"we are fed up as residents of Sector 12 have not received drinking water for 2 weeks now. This should have been fixed long ago.","Water Supply"
"SIR/MADAM a chain snatching incident occurred near the slum area yesterday.","Police"
"I am writing to report that buses on the route through Ward 7 are always late since MORNING.","Transport"
"Just letting you know there are huge potholes on the road near the outskirts of the city.","Roads"
"Could you please look into the issue that the power supply to Ward 7 keeps tripping every few hours? Please send someone to fix this soon.","Electricity"
"I am writing to report that we suspect sewage is mixing with drinking water supply in Nehru Colony","Water Supply"
"Kindly note that the road divider near our lane is broken and dangerous for drivers.","Roads"
"there are huge potholes on the road near our lane.","Roads"
"This letter is to inform the department that there is a lack of medicines at the health center near the bus stand area. This should have been fixed long ago","Health"
"URGENT: illegal parking near the corner shop area is causing trouble   for residents.","Police"
"This is an emergency situation. the health camp promised near the railway station road was never conducted. Hope to see quick action on this","Health"
"Please act fast, road maintenance near the school area has not been done for the past few hours. Hope to see quick action on THIS.","Roads"
"We are fed up as there is a major water leakage near the old town area for 2 weeks now.","Water Supply"
"I would like to bring to your attention that the newly laid road near the goverment quarters is already cracking. Requesting immediate action from your department.","Roads"
"URGENT: suspicious activities have been noticed near our village for over a week. Kindly resolve this issue at the earliest","Police"
"people are dumping waste illegally near the housing society. This has been a recurring issue in the area and is causing a lot of inconvenience to residents. Kindly resolve this issue at the earliest.","Sanitation"
"We are suffering a lot because there are huge potholes on the road near our colony. We need a permanent solution to this problem.","Roads"
"I wish to lodge a complaint regarding the fact that road maintenance near our lane has not been done for the last few months. We need a permanent solution to this problem.","Roads"
"This letter is to inform the department that contaminated water is being supplied to   households in Model Town.","Water Supply"
"Could you please look into the issue that the water pressure in our street is extremely low? Please take strict   action against those responsible.","Water Supply"
"a large pothole near the main market area caused an accident yesterday. This has been a recurring issue in the area and is causing a lot of inconvenience to residents. Hope to see quick action on THIS.","Roads"
"the SEWAGE pipeline near Ward 7 has been leaking for the last 5 days.","Drainage"
"the borewell near Sector 12 has stopped working for over a week.","Water Supply"
"This needs immediate attention. patients at the hospital near the residential block face very long waiting times. This should have been fixed long ago.","Health"
"this is to formally inform you that the government hospital near the corner shop area is extremely unclean.","Health"
"URGENT: illegal parking near the slum area is blocking the road. We need a permanent solution to this problem.","Transport"
"the road divider near the college road is broken and dangerous for drivers.","Roads"
"I feel helpless because auto rickshaw drivers near the outskirts of the city are overcharging passengers. This should have been fixed long ago","Transport"
"We are suffering a lot because burning of garbage near Shastri Nagar is causing air pollution. Regards.","Sanitation"
"This needs immediate attention. the footpath near the apartment complex is damaged making it hard for pedestrians. Thank you.","Roads"
"Just letting you know public health concerns are rising due to poor waste disposal near the temple area. Hope to see quick action on this.","Health"
"Sir just want to say mosquito control measures have not been taken near the outskirts of the city since yesterday. Please send someone to fix this soon","Health"
"This needs immediate attention. the water pipe near the temple area burst and is flooding the street. This should have been fixed long ago.","Water Supply"
"Sir just want to say the open drain near Shastri Nagar is a breeding ground for mosquitoes.","Drainage"
"waterlogging near the local market has made it impossible to walk since this afternoon. This has been a recurring issue in the area and is causing a lot of inconvenience to residents. Requesting immediate action from your department","Drainage"
"kindly note that waterlogging near Shastri Nagar has made it impossible to walk since this afternoon.","Drainage"
"the newly laid road near the industrial area is already cracking.","Roads"
"Could you please look into the issue that the ambulance service near the bridge area took too long to respond continuously since last night? This should have been fixed long ago.","Health"
"Sir/madam mosquito control measures have not been taken near Model Town for several days","Health"
"sir just want to say the government hospital near sector 12 is extremely unclean.","Health"
"I feel helpless because traffic congestion near MG Road has become unbearable. Requesting immediate action from your department.","Transport"
"We are fed up as the bus stop near Ward 7 has been broken since this afternoon. Thank you.","Transport"
"This is an emergency situation. there is no proper parking space available near the outskirts of the city. Thank you.","Transport"
"loose electric wires are hanging near Shastri Nagar, posing a safety risk. This has been a recurring issue   in the area and is causing a lot of inconvenience to residents.","Electricity"
"URGENT: the drainage cover near our building is broken, its a safety hazard. This should have been fixed long ago.","Drainage"
"illegal parking near the old town area is blocking the ROAD. This has been a recurring issue in the area and is causing a lot of inconvenience to residents.","Transport"
"the sewage pipeline near the main market area has been leaking for over a week. This has been a recurring issue in the area and is causing a lot of inconvenience to residents. We need a permanent solution to this problem","Drainage"
"Hello, the road divider near our COLONY is broken and dangerous for drivers.","Roads"
"the power supply to Gandhi Nagar keeps tripping every few hours.","Electricity"
"Could you please look into the issue that the road in the residential block is completely broken and unusable? Thank you.","Roads"
"a chain snatching incident occurred near the apartment complex yesterday.","Police"
"there is no proper parking space available near the residential block. This has been a recurring issue in the area and is causing a lot of inconvenience to residents. This should have been fixed long ago.","Transport"
"it is so painful to see that the water pressure in gandhi nagar is extremely low. this should have been fixed long ago.","Water Supply"
"people are dumping waste illegally near Ward 7. This has been a recurring issue in the area and is causing a lot of inconvenience to residents. Please help us out.","Sanitation"
"My family is really struggling since the drainage near the apartment complex has been overflowing since morning. Kindly resolve this issue at the earliest.","Drainage"
"the sewage pipeline near the corner shop area has been leaking for the last few months. This has been a recurring issue in the area and is causing a lot of inconvenience to residents. Thank you.","Drainage"
"This needs immediate attention. a huge pile of garbage has accumulated near the local market. Kindly resolve this issue at the earliest","Sanitation"
"I feel helpless because stagnant water from the drain near our street is causing diseases. Hope to see quick action on this.","Drainage"
"Sir just want to say loud music from a shop near the housing society disturbs the whole NEIGHBOURHOOD.","Police"
"kindly note that there is a lot of noise disturbance near our lane at night. please send someone to fix this soon.","Police"
"could you please look into the issue that an electric pole near the industrial area is damaged and leaning dangerously? Please take strict action against those responsible","Electricity"
"the borewell near the hospital area has stopped working since this afternoon. This has been a recurring issue in the area and is causing a lot of inconvenience to residents. Please look into this matter as soon as possible.","Water Supply"
"Could you please look into the issue that the transformer near the bus stand area is damaged and sparking for the past few hours? Requesting immediate action from your department","Electricity"
"Immediate action required: the traffic signal near Sector 12 has been malfunctioning for the past 3 days.","Transport"
"URGENT: a chain snatching incident occurred near the hospital area yesterday. Waiting for a quick response from your side.","Police"
"We are fed up as the water coming from the tap in the local market is dirty and smells bad. Regards.","Water Supply"
"I am really frustrated that water supply to the college road has become very irregular for the last few months.","Water Supply"
"could you please look into the issue that the public cleanliness near the local market has deteriorated badly? this should have been fixed long ago.","Sanitation"
"the road divider near Shastri Nagar is broken and dangerous for drivers. This has been a recurring issue in the area and is causing a lot of inconvenience to residents. Waiting for a quick response from your side.","Roads"
"Kindly note that BURNING of garbage near our building is causing air pollution. Please look into this matter as soon as possible.","Sanitation"
"the garbage truck has not visited Shastri Nagar since yesterday. This has been a recurring issue in the area and is causing a lot of inconvenience to residents. Please take strict action against those responsible.","Sanitation"
"Hello, a chain snatching incident occurred near the panchayat office area yesterday. Kindly resolve this issue at the earliest","Police"
"the garbage truck has not visited Ward 7 since this afternoon","Sanitation"
"could you please look into the issue that the government hospital near the flyover is extremely unclean? this should have been fixed long ago.","Health"
"Could you please look into the issue that stagnant water from the drain near the main market area is causing diseases? Thank you.","Drainage"
"Could you please look into the issue that the substation near the outskirts of the city has been making loud noises for the last few months? Hope to see quick action on this.","Electricity"
"We are fed up as the power supply to our village keeps tripping every few hours. Please help us out.","Electricity"
"the water pressure in the temple area is extremely low.","Water Supply"
"We   are suffering a lot because suspicious activities have been noticed near Shastri Nagar since Monday. Please help us out.","Police"
"there is a lot of noise disturbance near Shastri Nagar at night. This has been a recurring issue in the area and is causing a lot of inconvenience to residents. Waiting for a quick response from your side","Police"
"could you please look into the issue that a chain snatching incident occurred near the housing society yesterday? Please look into this matter as soon as possible.","Police"
"We are suffering a lot because loud music from a shop near the flyover disturbs the whole NEIGHBOURHOOD.","Police"
"Guys please note waterlogging near the local market has made it impossible to walk for the last month","Drainage"
"we suspect sewage is mixing with drinking water supply in the main market area. This has been a recurring issue in the area and is causing a lot of inconvenience to residents.","Water Supply"
"the sanitation INSIDE the hospital near the main market area is very poor. This has been a recurring issue in the area and is causing a lot of inconvenience to residents. This should have been fixed long ago.","Health"
"To whoever reads this, heavy rains have washed away part of the road at the bus stand area.","Roads"
"We are suffering a lot because illegal parking near our block is blocking the road. Please help us out.","Transport"
"a huge pile of garbage has accumulated near our lane.","Sanitation"
"residents of our block have not received drinking water for almost 10 days. This has been a recurring issue in the area and is causing a lot of inconvenience to residents. Please send someone to fix this soon.","Water Supply"
"This is to formally inform you that the open drain near the industrial area is a breeding ground for mosquitoes.","Drainage"
"Kindly note that garbage has not been collected in our street for 2 weeks now. Kindly resolve this issue at the earliest.","Sanitation"
"This letter is to inform the department that waterlogging near the college road has   made it impossible to walk for the last month.","Drainage"
"I feel helpless because the bus stop near the railway station road has been broken for the last 5 days.","Transport"
"the traffic signal near MG Road has been malfunctioning since this afternoon. This has been a recurring issue in the area and is causing a lot of inconvenience to residents","Transport"
"URGENT: a pipeline near the outskirts of the city has broken and water is flooding the road. This should have been fixed long ago","Water Supply"
"the power supply to the residential block keeps tripping every few hours. This has been a recurring issue in the area and is causing a lot of inconvenience to residents","Electricity"
"I would like to bring to your attention that there   is a lot of noise disturbance near our lane at night.","Police"
"the transformer near Nehru Colony is damaged and sparking   since last week.","Electricity"
"people are dumping waste illegally near our neighbourhood. This has been a recurring issue in the area and is causing a lot of inconvenience to residents. Please help us out.","Sanitation"
"to whoever reads this, the electricity bill for the panchayat office area shows incorrect meter reading.","Electricity"
"This needs immediate attention. the borewell near the railway station road has stopped working for 2 weeks now.","Water Supply"
"Could you please look into the issue that contaminated water   is being supplied to households in our neighbourhood? Requesting immediate action from your department.","Water Supply"
"I would like to bring to your attention that the dustbins near the government quarters are overflowing with waste.","Sanitation"
"This is an emergency situation. the bus stop near MG Road has been broken   since last week. Kindly resolve this issue at the earliest.","Transport"
"Immediate action required: construction debris has been left on the road near our colony for the last few months.","Roads"
"i wish to lodge a complaint regarding the fact that illegal parking near the corner shop area is causing trouble for residents.","Police"
"I would like to bring to your attention that water supply to our village has become very irregular since Monday.","Water Supply"
"I wish to lodge a complaint regarding the fact that a pipeline near the corner shop area has broken and water is flooding the road.","Water Supply"
"Hello, STRAY dogs near the hospital in the outskirts of the city are becoming a health hazard. Please look into this matter as soon as possible.","Health"
"Could you please look into the issue that the public toilet near the slum area is extremely unhygienic? Waiting for a quick response from your side.","Sanitation"
"the health camp promised near Nehru Colony was never conducted. This has been a recurring issue in the area and is causing a lot of inconvenience to residents. Hope to see quick action on this","Health"
"the road near the hospital area has developed deep cracks","Roads"
"We are suffering a lot because a chain snatching incident occurred near the industrial area yesterday. We need a permanent solution to this problem.","Police"
"the local train service near the panchayat office area has been delayed continuously since last NIGHT. This has been a recurring issue in the area and is causing a lot of inconvenience to residents. Please look into this matter as soon as possible.","Transport"
"Sir/madam auto rickshaw drivers near Model Town are overcharging passengers.","Transport"
"Just letting you know we have received no water supply in the hospital area since this afternoon.","Water Supply"
"I wish to lodge a complaint regarding the fact that the bus conductor near the industrial area was rude to passengers.","Transport"
"URGENT: the public cleanliness near the slum area has deteriorated badly. Hope to see quick action on this.","Sanitation"
"I would like to bring to your attention that the health camp promised near the hospital area was never conducted","Health"
"i am writing to report that the TRANSFORMER near MG Road is damaged and sparking for the last month.","Electricity"
"This is an emergency situation. we have received no water supply in the park area since this afternoon.","Water Supply"
"this is to formally inform you that the open drain near the government quarters is a breeding ground for mosquitoes.","Drainage"
"the sewage pipeline near our village has been leaking since this afternoon. This has been a recurring issue in the area and is causing a lot of inconvenience to residents. Thank you.","Drainage"
"this is an emergency situation. the road in the apartment complex is completely broken and unusable. Thank you.","Roads"
"Could you please look into the issue that traffic jams keep happening near the hospital area due to damaged roads? We need   a permanent solution to this problem.","Roads"
"This is to formally inform you that anti social elements have been loitering near the outskirts of the city since last week. Regards.","Police"
"I feel helpless because water supply to the goverment quarters has become very irregular for the last month. Please send someone to fix this soon.","Water Supply"
"Please act fast, a street fight broke out near Ward 7 last night. Waiting for a quick response from your side.","Police"
"auto rickshaw   drivers near our block are overcharging passengers.","Transport"
"My family   is really struggling since a chain snatching incident occurred near the apartment complex yesterday. Hope to see quick action on this.","Police"
"Immediate action required: people are dumping waste illegally near the school area. Regards.","Sanitation"
"the road markings near Shastri Nagar have faded completely. This has been a recurring issue in the area and is causing a lot of inconvenience to residents. Please take strict action against those responsible.","Roads"
"buses on the route through Nehru Colony are always late since last week. This has been a recurring issue in the area and is causing a lot of inconvenience to residents. Thank you.","Transport"
"water supply to the residential block has become very irregular since morning.","Water Supply"
"auto rickshaw drivers near mg road are overcharging passengers.","Transport"
"Sir/madam traffic jams keep happening near the park area due to damaged roads.","Roads"
"a huge pile of garbage has accumulated near Shastri Nagar. This has been a recurring ISSUE in the area and is causing a lot of inconvenience to residents.","Sanitation"
"It is so painful to see that the garbage truck has not visited the main market area since yesterday. Please take strict action against those responsible.","Sanitation"
"construction debris has been left on the road near the park area since morning. This has been a recurring issue in the area and is causing a lot of inconvenience to residents. We need a permanent solution to this problem.","Roads"
"Kindly note that there is a lot of noise disturbance near the highway junction at night. Please send someone to fix this soon","Police"
"the dustbins near our block are overflowing with waste. This has been a recurring issue in the area and is causing a lot of inconvenience to residents. We need a permanent solution to this problem.","Sanitation"
"loud music from a shop near our street disturbs the whole neighbourhood. This has been a recurring issue in the area and is causing a lot of inconvenience to residents. We need a permanent solution to this problem.","Police"
"uRGENT: mosquito control measures have not been taken near the bus stand area since Monday. Please send someone to fix this soon.","Health"
"I wish to lodge a complaint regarding the fact that the power supply to the industrial area keeps tripping every few hours.","Electricity"
"there is no proper parking space available near the temple AREA. This has been a recurring issue in the area and is causing a lot of inconvenience to residents. Please help us out.","Transport"
"This needs immediate attention. the traffic signal near the apartment complex has been malfunctioning for over a week.","Transport"
"the open drain near Shastri Nagar is a breeding ground for mosquitoes. This has been a recurring issue in the area and is causing a lot of inconvenience to residents. Kindly resolve this issue at the earliest.","Drainage"
"I am writing to report that the transformer near the school area is damaged and sparking for the past 3 days. Requesting immediate action from your department.","Electricity"
"We are fed up as the health camp promised near the old town area was never conducted.","Health"
"Hi team, people are dumping waste illegally near our lane.","Sanitation"
"I would like to bring to your attention that burning of garbage near our street is causing air pollution.","Sanitation"
"Hi team, the road in Ward 7 is completely broken and unusable.","Roads"
"my family is really struggling since water supply to the housing society has become very irregular for the last few months. please take strict action against those responsible.","Water Supply"
"Hello, there is a terrible smell coming from the drain near the government quarters.","Drainage"
"Sir just want to say mosquito breeding is rampant due to uncollected trash in Nehru Colony. Waiting for a quick response from your side.","Sanitation"
"It is so painful to see that the road markings near the industrial area have faded completely. Thank you.","Roads"
"the drainage near the slum area has been overflowing since last Sunday.","Drainage"
"Hi team, heavy rains have washed away part of the road at Ward 7.","Roads"
"the sewage pipeline near the residential block has been leaking since Monday","Drainage"
"I feel helpless because the road markings near the government quarters have faded completely. Please take strict action against those responsible.","Roads"
"URGENT: stagnant water from the drain near the highway junction is causing diseases. This should have been fixed long ago.","Drainage"
"buses on the route through Shastri Nagar are always late for the last few months.","Transport"
"Could you please look into the issue that the water pipe near the railway station road burst and is flooding the street? Hope to see quick action on this.","Water Supply"
"Could you please look into the issue that the road in our building is completely broken and unusable? Please look into this matter as soon as possible.","Roads"
"public health concerns are rising due to poor waste disposal near our colony. This has been a recurring issue in the area and is causing a lot of inconvenience to residents. Please send someone to fix this soon.","Health"
"This is to formally inform you that the dustbins near the park area are overflowing with waste.","Sanitation"
"there is no proper parking space available near the panchayat office area.","Transport"
"Hi team, auto rickshaw drivers near the housing society are overcharging passengers. Kindly resolve this issue at the earliest.","Transport"
