"complaint","department"
"I wish to lodge a complaint regarding the fact that there are frequent power cuts in the housing society since last Sunday. Requesting immediate action from your department.","Electricity"
"This is an emergency situation. illegal parking near our block is blocking the road. Please take strict action against those responsible.","Transport"
"the water tanker never arrives on time in the slum area. This has been a recurring issue in the area and is causing a lot of inconvenience to residents. Thank you.","Water Supply"
"I feel helpless because a live wire fell near Gandhi NAGAR and no one has come to fix it for over a week.","Electricity"
"Could you please look into the issue that the drainage cover near Nehru Colony is broken, its a safety hazard?","Drainage"
"It is so painful to see that heavy rain caused the drain near the residential block to overflow into houses. Please take strict action against those responsible","Drainage"
"HELLO, there is a lot of noise disturbance near our building at night.","Police"
"Could you please look into   the issue that auto rickshaw drivers near our block are overcharging passengers? Please send someone to fix this soon.","Transport"
"stagnant water from the drain near the housing society is causing diseases.","Drainage"
"the local train service near MG Road has been delayed for over a week. This has been a recurring issue in the area and is   causing a lot of inconvenience to residents. Kindly resolve this issue at the earliest.","Transport"
"burning of garbage near the railway station road is causing air pollution. This has been a recurring issue in the area and is causing a lot of inconvenience to residents. Regards.","Sanitation"
"stray dogs near the hospital in the panchayat office area are becoming a health hazard. This has been a recurring issue in the area and is causing a lot of inconvenience to residents. Regards.","Health"
"the health camp promised near the apartment complex was never conducted.","Health"
"we suspect sewage is mixing with drinking water supply in the housing society. This has   been a recurring issue in the area and is causing a lot of inconvenience to residents. Hope to see quick action on this.","Water Supply"
"there is a lot of noise disturbance near the slum area at night. This has been a recurring issue in the area and is causing a lot of inconvenience to residents","Police"
"there are huge potholes on the road near our village.","Roads"
"the road divider near the temple area is broken and dangerous for drivers. This has been a recurring issue in the area and is causing a lot of INCONVENIENCE to residents. Thank you.","Roads"
"I wish to lodge a complaint regarding the fact that there is no proper parking space available near the hospital area.","Transport"
"Hello, there is a terrible smell coming from the drain near Gandhi Nagar. Please take strict action against those responsible.","Drainage"
"Hello, anti social elements have been loitering near our colony since last week.","Police"
"We are fed up as the sanitation inside the hospital near the industrial area is very poor. Please help us out.","Health"
"I am really frustrated that drains in Nehru Colony are completely blocked with waste. Waiting for a quick response from your side.","Drainage"
"Immediate action required: illegal parking near the local market is blocking the road. Please look into this matter as soon as possible.","Transport"
"we are suffering a lot because an electric pole near the local market is DAMAGED and leaning dangerously. Please send someone to fix this soon.","Electricity"
"This is to formally inform you that public health concerns are rising due to poor waste disposal near our building. Requesting immediate action from your department.","Health"
"Sir/madam garbage has not been collected in the residential block since the rains started. Please help us out.","Sanitation"
"Could you please look into the issue that the power supply to Ward 7 keeps tripping every few hours? Hope to see quick action on this.","Electricity"
"My family is really struggling since the sanitation inside the hospital near Shastri Nagar is very poor. Please take strict action against those responsible.","Health"
"We are   fed up as a street fight broke out near Sector 12 last night. Thank you.","Police"
"the bus stop near the outskirts of the city has been broken since the rains started. This has been a recurring issue in the area and is causing a lot of inconvenience to residents. Waiting for a quick response from your side.","Transport"
"there is a terrible smell coming from the drain near the water tank area.","Drainage"
"Kindly note that illegal parking near the old town area is causing trouble for residents. Please help us   out.","Police"
"the TRAFFIC signal near the park area has been malfunctioning for the last 5 days.","Transport"
"This is to formally inform you that the road near our COLONY has developed deep cracks.","Roads"
"I would like to BRING to your attention that patients at the hospital near Model Town face very long waiting times. Thank you.","Health"
"Could you please look into the issue that illegal parking near the panchayat office area is blocking the road? We need a permanent solution to this problem.","Transport"
"Could you please look into the issue that heavy rain caused the drain near Sector 12 to overflow into houses?","Drainage"
"URGENT: the local train service near our building has been delayed since yesterday. Waiting for a quick response from your side.","Transport"
"My   family is really struggling since people are dumping waste illegally near the flyover.","Sanitation"
"Please act fast, there is a shortage of medical staff at the clinic near Shastri Nagar. Thank you.","Health"
"Could you please look into the issue that drains in our block are completely blocked with waste? Please send someone to fix this soon.","Drainage"
"the sanitation inside the hospital near our   building is very poor. This has been a recurring issue in the area and is causing a lot of inconvenience to residents. This should have been fixed long ago.","Health"
"traffic congestion near MG Road has become unbearable.","Transport"
"water supply to the apartment complex has become very irregular since Monday. This has been a recurring issue in the area and is causing a lot of inconvenience to residents.","Water Supply"
"I would like to bring to your attention that stray dogs near the hospital in Sector 12 are becoming a health hazard. Hope to see quick action on this","Health"
"We are fed up as heavy rain caused the drain near the housing society to OVERFLOW into houses. Thank you.","Drainage"
"Kindly note that the newly laid road near the local market is already cracking. Kindly resolve this issue at the earliest.","Roads"
"sir just want to say the public cleanliness near our block has deteriorated badly. Waiting for a quick response from your side.","Sanitation"
"the power supply to the industrial area keeps tripping every few hours.","Electricity"
"a theft was reported near the main market area and no action has been taken. This has been a recurring issue in the area and is causing a lot of inconvenience to residents. We need a permanent solution to this problem","Police"
"Could you please look into the issue that an unauthorized electricity connection is causing overload in the water tank area? Please send someone to fix this soon.","Electricity"
"Could you please look into the issue that the public toilet near the bridge area is extremely unhygienic? Please take strict action against those responsible.","Sanitation"
"Just letting you know a street fight broke out near Shastri Nagar last night.","Police"
"This is to formally inform you that an unauthorized electricity connection is causing overload in the housing society.","Electricity"
"sewage is overflowing onto the street near the main market area.","Drainage"
"my family is really struggling since garbage has not been collected in the housing society since yesterday. Requesting immediate action from your department.","Sanitation"
"This letter is to inform the department that illegal parking near our street is blocking the road.","Transport"
"I am writing to report that there is a leaking valve near our neighbourhood wasting a lot of water. Kindly resolve this issue at the earliest","Water Supply"
"a live wire fell near the main MARKET area and no one has come to fix it since yesterday.","Electricity"
"This is to FORMALLY inform you that there is a lack of medicines at the health center near the college road. Kindly resolve this issue at the earliest.","Health"
"Could you please look into the issue that there is a lot of noise disturbance near the bus   stand area at night? Hope to see quick action on this.","Police"
"This letter is to inform the department that the street lights in the bus stand area havent worked continuously since last night","Electricity"
"It is so painful to see that mosquito control measures have not been taken near Model Town continuously since last night. Regards.","Health"
"I am writing to report that the bus conductor near the apartment complex was rude to passengers","Transport"
"My family is really struggling since the footpath near Gandhi Nagar is damaged making it hard for pedestrians. This should have been fixed long ago.","Roads"
"please resolve this on priority basis. waterlogging near the residential block has made it impossible to walk for several days","Drainage"
"the transformer near the main market area is damaged and sparking since morning.","Electricity"
"a huge pile of garbage has accumulated near Gandhi Nagar. This has been a recurring issue in the area and is causing a lot of inconvenience to residents. Please help us out.","Sanitation"
"Hi team, the traffic signal near Sector 12 has been malfunctioning for the past 3 days. Please send someone to fix this soon.","Transport"
"there are huge potholes on the road near the flyover.","Roads"
"This letter is to inform the department that construction debris has been left on the road near our street for the past few hours. Thank you.","Roads"
"the water tanker never arrives on time in our neighbourhood. This has been a recurring issue in the area and is causing a lot of inconvenience to residents. Please send someone to fix this soon.","Water Supply"
"We are suffering a lot because the sewage pipeline near the local MARKET has been leaking for the last month. Please help us out.","Drainage"
"loose electric wires are hanging near Model Town, posing a safety risk.","Electricity"
"My family is really struggling since we have RECEIVED no water supply in the panchayat office area for 2 weeks now. Please help us out.","Water Supply"
"This is to formally inform you that there has been a power failure in the water tank area continuously since last night.","Electricity"
"Could you please look into the issue that the borewell near the flyover has stopped working for several days? We need a permanent solution to this problem","Water Supply"
"I would like to bring to your attention that the buses passing through the park area are dangerously overcrowded. Thank you.","Transport"
"It is so painful to see that the health camp promised near Gandhi Nagar was never conducted.","Health"
"a street fight broke out near our village last night. This has been a recurring issue in the area and is causing a lot of inconvenience to residents.","Police"
"It is so painful to see that a large pothole near the college road caused an accident yesterday. Kindly resolve this issue at the earliest.","Roads"
"this is an emergency situation. the local train service near the temple area has been delayed for 2 weeks now. Requesting immediate action from your department.","Transport"
"a huge pile of garbage has accumulated near Nehru Colony.","Sanitation"
"Hi team, the electricity meter installed at the goverment quarters seems to be faulty. Please help us out.","Electricity"
"I am writing to report that the transformer near Model Town is damaged and sparking since last Sunday. Regards.","Electricity"
"Could you please look into the issue that stagnant water from the drain near Shastri Nagar is causing diseases?","Drainage"
"drains in the water tank area are completely blocked with waste. This has been a recurring issue in the area and is causing a lot of inconvenience to residents. Please help us out.","Drainage"
"To whoever reads this, the public cleanliness near Model Town has deteriorated badly.","Sanitation"
"immediate action required: the sewage pipeline near our colony has been leaking for the past few hours. please help us out.","Drainage"
"Could you please look into the issue that the garbage truck has not visited our lane for several days? Thank you","Sanitation"
"could you please look into the issue that there has been a power failure in the slum area for 2 weeks now? please send someone to fix this soon.","Electricity"
"We are fed up as a THEFT was reported near our lane and no action has been taken.","Police"
"I am really frustrated that the bus conductor near our building was rude to passengers. Requesting immediate action from your department","Transport"
"My family is really struggling since the garbage truck has not visited the industrial area since morning. Please look into this matter as soon as possible.","Sanitation"
"My family is really struggling since water supply to the slum area has become very irregular since yesterday. Hope to see quick action on this.","Water Supply"
"Immediate action required: the road markings near the hospital area have faded completely. Please look into this matter as soon as possible.","Roads"
"traffic congestion near the   slum area has become unbearable.","Transport"
"kindly note that burning of garbage near our building is causing air pollution.","Sanitation"
"Sir/madam the ambulance service near our colony took too long to respond for 2 weeks now. This should have been fixed long ago.","Health"
"the bus stop near the school area has been broken since this afternoon. This has been a recurring issue in the area and is causing a lot of inconvenience to residents. Thank you","Transport"
"there are huge potholes on the road near the slum area.","Roads"
"My family is really struggling since the public toilet near the corner shop area is extremely unhygienic. Waiting for a quick response from your side.","Sanitation"
"Could you please look into the issue that residents of the highway junction have not received drinking water for the last month? Thank you.","Water Supply"
"Kindly note that traffic congestion near the local market has become unbearable.","Transport"
"Could you please look into the issue that burning of garbage near the government quarters is causing air pollution? Please send someone to fix this soon.","Sanitation"
"the traffic signal near the hospital area has been malfunctioning for the past 3 days","Transport"
"public health concerns are rising due to poor waste disposal near the railway station road. This has been a recurring issue in the area and is causing a lot of inconvenience to residents. Hope to see quick action on this.","Health"
"Could you please look into the issue that an electric pole near the industrial area is damaged and leaning dangerously? Hope to see quick action on this.","Electricity"
"drains in the industrial area are completely blocked with waste. This has been a recurring issue in the area and is causing a lot of inconvenience to residents. Regards.","Drainage"
"hello, the sewage pipeline near MG Road has been leaking for the last few months. PLEASE send someone to fix this soon.","Drainage"
"Guys please note traffic violations are common near Ward 7 and no one is checking. Requesting immediate action from your department","Police"
"Guys please note traffic violations are common near the slum area and no one is checking.","Police"
"could you please look into the issue that the traffic signal near the residential block has been malfunctioning since last week? requesting immediate action from your department.","Transport"
"Kindly note that the footpath near the bus stand area is damaged making it hard for pedestrians. Please help us out.","Roads"
"This is to formally inform you that traffic congestion near the outskirts of the city has become unbearable.","Transport"
"Immediate action required: buses on the route through the main market area are always late for 2 weeks now. Hope to see quick action on this.","Transport"
"there is a lot of noise disturbance near our lane at night. this has been a recurring issue in the area and is causing a lot of inconvenience to residents. this should have been fixed long ago.","Police"
"SIR/MADAM the ambulance service near the government quarters took too long to respond for the last few months.","Health"
"I wish to lodge a complaint regarding the fact that the public cleanliness near the hospital area has deteriorated badly","Sanitation"
"This needs immediate attention. the newly laid road near the school area is already cracking. Please look into this matter as soon as possible","Roads"
"garbage has not been collected in the highway junction since the rains started","Sanitation"
"could you please look into the issue that a group of people has been creating public disturbance near the apartment complex for several days? Please look into this matter as soon as possible.","Police"
"We are suffering a lot because stray animals are scattering garbage all over MG Road. Waiting for a quick response from your side.","Sanitation"
"My family is really struggling since the sewage pipeline near Nehru Colony has been leaking for the past 3 days.","Drainage"
"URGENT: there is a shortage of medical staff at the clinic near our block. KINDLY resolve this issue at the earliest.","Health"
"Guys please note the health camp promised near the apartment complex was never conducted. Please look into this matter as soon as possible.","Health"
"the water pipe near the college road burst and is flooding the street. This has been a recurring issue in the area and is causing a lot of inconvenience to residents. Regards","Water Supply"
"URGENT: the drainage cover near the apartment complex is broken, its a safety hazard. Please look into this matter as soon as possible.","Drainage"
"the garbage truck has not visited Nehru Colony for the past 3 days. This has been a recurring issue in the area and is causing a lot of inconvenience to residents. We need a permanent solution to this problem.","Sanitation"
"the local train service near our lane has been delayed for the past 3 days. This has been a recurring issue in the area and is causing a lot of inconvenience to residents. Thank you.","Transport"
"heavy rains have washed away part of the road at the temple AREA. This has been a recurring issue in the area and is causing a lot of inconvenience to residents. Hope to see quick action on this.","Roads"
"This is an emergency situation. burning of garbage near our village is causing air pollution.","Sanitation"
"this is to formally inform you that the road divider near the industrial area is broken and dangerous for drivers.","Roads"
"Please act fast, water supply to our colony has become very irregular for the last 5 days. Thank you.","Water Supply"
"the dustbins near MG Road are overflowing with waste. This has been a recurring issue in the area and is causing a lot of inconvenience to residents. Please take strict action against those responsible.","Sanitation"
"people are dumping waste illegally near Gandhi Nagar. This has been a recurring issue in the area and is causing a lot of inconvenience to RESIDENTS. Waiting for a quick response from your side.","Sanitation"
"there is a shortage of medical staff at the clinic near the bridge area. This has been a recurring issue in the area and is causing a lot of inconvenience to RESIDENTS. Hope to see quick action on this.","Health"
"I am really frustrated that drains in our neighbourhood are completely blocked with waste. We need a permanent solution to this problm.","Drainage"
"could you please look into the issue that burning of garbage near the school area is causing air pollution? Waiting for a quick response from your side.","Sanitation"
"the dustbins near the water tank area are overflowing with waste. This has been a recurring issue in the area and is causing a lot of inconvenience to residents. Thank you.","Sanitation"
"the substation near the outskirts of the city has been making loud noises for several days. This has been a recurring issue in the area and is causing a lot of inconvenience to residents. Kindly resolve this issue at the earliest","Electricity"
"I feel helpless because waterlogging near the corner shop area has made it impossible to walk since morning. This should have   been fixed long ago.","Drainage"
"Kindly note that a live wire fell near the railway station road and no one has come to fix it for over a week.","Electricity"
"Please act fast, garbage has not been collected in the railway station road since last Sunday. Please take strict action against those responsible.","Sanitation"
"Guys please note water supply to the railway station road has become very irregular for several days.","Water Supply"
"Kindly note that heavy rain caused the drain near the flyover to overflow into houses.","Drainage"
"Guys please note the garbage truck has not visited our building continuously since last night. Kindly resolve this issue at the earliest.","Sanitation"
"suspicious activities have been noticed near the local market since yesterday.","Police"
"illegal parking near our colony is causing trouble for residents.","Police"
"This needs immediate attention. the electricity meter installed at the temple area seems to be faulty. We need a permanent solution to this problem.","Electricity"
"sir just want to say suspicious activities have been noticed near our village for several days. Please send someone to fix this soon.","Police"
"Could you please look into the issue that the public cleanliness near Model Town has deteriorated badly? Kindly resolve this issue at the earliest.","Sanitation"
"suspicious activities have been noticed near our street since last Sunday.","Police"
"stagnant water from the drain near Nehru Colony is causing diseases","Drainage"
"Sir/madam suspicious activities have been noticed near Nehru   Colony for over a week.","Police"
"I am really frustrated that the drainage cover near the highway junction is broken, its a safety hazard. We need a permanent solution to this PROBLEM.","Drainage"
"I wish to lodge a complaint regarding the fact that we are facing severe voltage fluctuation in our village. Requesting immediate action from your department.","Electricity"
"a pipeline near the housing society has broken and water is flooding the road. This has been a recurring issue in the area and is causing a lot of inconvenience to residents. Thank you.","Water Supply"
"garbage has not been collected in the railway station road continuously since last night. This has been a recurring issue in the area and is causing a lot of inconvenience to residents. We need a permanent solution to this problem.","Sanitation"
"Just letting you know illegal parking near the panchayat office area is blocking the road.","Transport"
"sir/madam we suspect sewage is mixing with drinking water supply in Ward 7. Hope to see quick action on this.","Water Supply"
"We are suffering a lot because the water pipe near Nehru Colony burst and   is flooding the street.","Water Supply"
"I feel helpless because the drainage near Ward 7 has been overflowing for the past 3 days. Regards","Drainage"
"there is a major water leakage near our village for the last 5 days. This has been a recurring issue in the area and is causing a lot of inconvenience to residents.","Water Supply"
"I wish to lodge a COMPLAINT regarding the fact that the electricity meter installed at the bus stand area seems to be faulty. Please help us out.","Electricity"
"Could you please look into the issue that the open drain near our village is a breeding ground for mosquitoes? Please send someone to fix this soon.","Drainage"
"We are suffering a lot because a chain snatching incident occurred near Sector 12 yesterday. Hope to see quick action on this.","Police"
"This needs immediate attention. the transformer near the highway junction is damaged and sparking for the past 3 days. Regards.","Electricity"
"the garbage truck has not visited the railway station road since Monday. This has been a recurring issue in the area and is causing a lot of inconvenience to residents. Kindly resolve this issue at the earliest","Sanitation"
"the power supply to our building keeps tripping every few hours. This has been a recurring issue in the area and is causing a lot of inconvenience to residents. Please send someone to fix this soon","Electricity"
"I am really frustrated that buses on the route through the panchayat office area are always late for the last month. Please take strict action against those responsible","Transport"
"I feel helpless because there has been no electricity supply in Nehru Colony since Monday. Hope to see quick action on this.","Electricity"
"My family is really struggling since the government hospital near Model Town is extremely unclean. Thank you.","Health"
"this is an emergency situation. the government hospital near Ward 7 is extremely unclean.","Health"
"I wish to lodge a complaint regarding the fact that the public cleanliness near our village has deteriorated badly. Please help us out","Sanitation"
"the bus stop near the outskirts of the city has been broken since MORNING.","Transport"
"I am writing to report that a huge pile of garbage has accumulated near the slum area. Hope to see quick action on this.","Sanitation"
