"complaint","department"
"This is to formally inform you that SEWAGE is overflowing onto the street near the college road.","Drainage"
"My family is really struggling since the garbage truck has not visited Nehru Colony since last Sunday. Requesting immediate action from your department.","Sanitation"
"Could you please look into the issue that construction debris has been left on the road near our neighbourhood for the last 5 days? Kindly resolve this issue at the earliest","Roads"
"Could you please look into the issue that residents of the housing society have not received drinking water for 2 WEEKS now?","Water Supply"
"mosquito control measures have not been taken near the old town area for the past few hours. This has been a RECURRING issue in the area and is causing a lot of inconvenience to residents. Kindly resolve this issue at the earliest.","Health"
"We are suffering a lot because the public cleanliness near MG Road has deteriorated badly. Requesting immediate action from your department.","Sanitation"
"Sir/madam residents of the bridge area have not received drinking WATER for over a week.","Water Supply"
"Could you please look into the issue that a pipeline near the hospital area has broken and water is flooding the road? This should have been fixed long ago.","Water Supply"
"Sir/madam a chain snatching incident occurred near Sector 12 yesterday.","Police"
"This is to formally inform you that suspicious activities have been noticed near the bridge area for the last few months. We need a permanent solution to this problm.","Police"
"a live wire fell near the local market and no one has come to fix it for the past few hours.","Electricity"
"Hello, patients at the hospital near the slum area face very long waiting times. Kindly resolve this issue at the earliest","Health"
"Sir/madam we suspect sewage is mixing with drinking water supply in the government quarters. Hope to see quick action on this.","Water Supply"
"My family is really struggling since the drainage cover near the residential block is broken, its a safety hazard. Please send someone to fix this soon.","Drainage"
"I feel helpless because contaminated water is being supplied to households in Gandhi Nagar. Hope to see quick action on this.","Water Supply"
"mosquito breeding is rampant due to uncollected trash in Gandhi Nagar","Sanitation"
"I wish to lodge a complaint regarding the fact that people are dumping waste illegally near Ward 7.","Sanitation"
"Immediate action required: there is no proper parking space available near the bridge area. This should have been fixed long ago.","Transport"
"I feel helpless because contaminated water is being supplied to households in the government quarters. Please help us out.","Water Supply"
"Could you please look into the issue that mosquito control measures have not been taken near Nehru Colony since morning? We need a permanent solution to this problem.","Health"
"this is to formally inform you that the dustbins near our street are overflowing with waste. we need a permanent solution to this problem.","Sanitation"
"Could you please look into the issue that buses on the route through Gandhi Nagar are always late for several days? Requesting immediate action from your department.","Transport"
"Guys please note there is a leaking valve near the railway station road wasting a lot of water. Regards.","Water Supply"
"We are fed up as the dustbins near the outskirts of the city are overflowing with waste. We need a permanent solution to this problem.","Sanitation"
"the water tanker never arrives on time in the panchayat office area. This has been a recurring issue in the area and is causing a lot of inconvenience to residents.","Water Supply"
"Just letting you know a street fight broke out near the temple area last night. This should have been fixed long ago.","Police"
"We are fed up as the road near our stret has developed deep cracks. Thank you.","Roads"
"a pipeline near the industrial area has broken and water is flooding the road. This has been a recurring issue in the area and is causing a lot of inconvenience to residents. We need a permanent solution to this problem.","Water Supply"
"I feel helpless because the buses passing through the park area are dangerously overcrowded. Please send someone to fix this soon.","Transport"
"We are suffering a lot because the buses passing through our village are dangerously overcrowded. Please take strict action against those responsible.","Transport"
"Please act fast, the water pipe near Nehru Colony burst and is flooding the street. Kindly resolve this issue at the earliest","Water Supply"
"Could you please look into the issue that stray animals are scattering garbage all over Ward 7? Thank you.","Sanitation"
"We are fed up as mosquito breeding is rampant due to uncollected trash in Ward 7. Requesting immediate action from your department.","Sanitation"
"This is an emergency situation. heavy rains have washed away part of the road at the government quarters. Waiting for a quick response from your side.","Roads"
"We are suffering a lot because the electricity meter installed at our street seems to be faulty. Please send someone to fix this soon.","Electricity"
"I am really frustrated that mosquito breeding is rampant due to uncollected trash in the outskirts of the city","Sanitation"
"there is a lot of noise disturbance near our colony at night.","Police"
"the ambulance service near the panchayat office area took too long to respond since the rains started. This has been a recurring issue in the area and is causing a lot of inconvenience to residents. This should have been fixed long ago.","Health"
"Kindly note that mosquito breeding is rampant due to uncollected trash in MG Road.","Sanitation"
"kindly note that heavy rains have washed away part of the road at the local market. Regards","Roads"
"We are fed up as sewage is overflowing onto the street near MG Road. Hope to see quick action on this.","Drainage"
"It is so painful to see that the footpath near the park area is damaged making it hard for pedestrians. Please send someone to fix this soon","Roads"
"KINDLY note that a theft was reported near our village and no action has been taken.","Police"
"I would like to bring to your attention that drains in the school area are completely blocked with waste.","Drainage"
"This needs immediate attention. contaminated water is being supplied to households in our neighbourhood. Please take strict action against those responsible.","Water Supply"
"I am writing to report that stagnant water from the drain near the panchayat office area is causing diseases. Kindly resolve this issue at the earliest.","Drainage"
"It is so painful to see that stray animals are scattering garbage all over our neighbourhood","Sanitation"
"It is so painful to see that the water coming from the tap in the outskirts of the city is dirty and smells bad. Regards.","Water Supply"
"i am writing to report that burning of garbage near the government quarters is causing air pollution. Regards.","Sanitation"
"My family is really struggling since a live wire fell near the corner shop area and no one has come to fix it for the past 3 days.","Electricity"
"We are fed up as the bus conductor near the slum area was rude to passengers. This should have been fixed long ago.","Transport"
"To whoever reads this, the water pressure in the corner shop area is extremely low. Please help us out.","Water Supply"
"We are suffering a lot because the garbage truck has not visited Sector 12 for almost 10 days. Please take strict action against those responsible.","Sanitation"
"garbage has not been collected in our colony since last Sunday.","Sanitation"
"URGENT: contaminated water is being supplied to households in our colony. This should   have been fixed long ago.","Water Supply"
"We are suffering a lot because there is no proper parking space available near the panchayat office area. Please take strict action against   those responsible.","Transport"
"Sir just want to say there is a shortage of medical staff at the clinic near the park area. Hope to see quick action on this.","Health"
"Could you please look into the issue that we suspect sewage is mixing with drinking water supply in the corner shop area? Please help us out.","Water Supply"
"the water pressure in the housing society is extremely low. this has been a recurring issue in the area and is causing a lot of inconvenience to residents. requesting immediate action from your department.","Water Supply"
"Guys please note construction debris has been left on the road near the highway junction since the rains started.","Roads"
"the footpath near the water tank area is damaged making it hard for pedestrians. This has been a recurring issue in the area and is causing a lot of inconvenience to residents. Thank you.","Roads"
"We are suffering a lot because contaminated water is being supplied to households in the outskirts of the city","Water Supply"
"the ambulance service near the railway station road took too long to respond for the last month.","Health"
"Sir/madam construction debris has been left on the road near our street since the rains started. Regards","Roads"
"the borewell near the local market has stopped working since yesterday. This has been a recurring issue in the area and is causing a lot of inconvenience to residents. Please send someone to fix this soon.","Water Supply"
"Just letting you know the water pressure in the temple area is EXTREMELY low.","Water Supply"
"I am writing to report that the public toilet near the local market is extremely unhygienic. Regards.","Sanitation"
"there is a terrible smell coming from the drain near our block.","Drainage"
"I wish to lodge a complaint regarding the fact that the garbage truck has not visited the bus stand area for the past few hours.","Sanitation"
"Could you please look into the issue that illegal parking near the railway station road is causing trouble for residents? We need a permanent solution to this problem.","Police"
"hello, construction debris has been left on the road near the slum area for 2 weeks now. please help us out.","Roads"
"URGENT: there are frequent power cuts in MG Road since last week. Hope to   see quick action on this.","Electricity"
"to whoever reads this, an unauthorized electricty connection is causing overload in Shastri Nagar.","Electricity"
"this letter is to inform the department that stray animals are scattering garbage all over our block. please take strict action against those responsible.","Sanitation"
"Immediate action required: water supply to the housing society has become very irregular for almost 10 days. Please take strict action against those responsible.","Water Supply"
"the power supply to Ward 7 KEEPS tripping every few hours. This has been a recurring issue in the area and is causing a lot of inconvenience to residents. Hope to see quick action on this.","Electricity"
"we are fed up as the road near the housing society has developed deep cracks.","Roads"
"a huge pile of garbage has accumulated near our village. This has been a recurring issue in the area and is causing a lot of inconvenience to residents. Waiting for a quick response from your side.","Sanitation"
"We are fed up as mosquito control measures have not been taken near the bridge area continuously since last night.","Health"
"I am writing to report that THERE has been a power failure in the outskirts of the city for the last month. This should have been fixed long ago.","Electricity"
"This letter is to inform the department that mosquito breeding is rampant due to uncollected trash in the old town area. Please send someone to fix this soon.","Sanitation"
"I would like to bring to your attention that the traffic signal near Ward 7 has been malfunctioning continuously since last night. Hope to see quick action on this","Transport"
"Immediate action required: auto rickshaw drivers near the industrial area are overcharging passengers. Please look into this matter as soon as possible.","Transport"
"This is an emergency situation. illegal parking near the flyover is blocking the road.","Transport"
"Could you please look into the issue that the street lights in the flyover havent worked for the past 3 days? Please send someone to fix this soon.","Electricity"
"my family is really struggling since the power supply to the water tank area keeps tripping every few hours. we need a permanent solution to this problem.","Electricity"
"COULD you please look into the issue that the buses passing through the railway station road are dangerously overcrowded? Waiting for a quick response from your side.","Transport"
"I would like to bring to your attention that the bus stop near Shastri Nagar has been broken for the last 5 DAYS.","Transport"
"It is so painful to see that waterlogging near the highway junction has made it impossible to walk for almost 10 days. Thank you.","Drainage"
"could you please look into the issue that there is a terrible smell coming from the drain near SECTOR 12?","Drainage"
"Guys please note the health camp promised near the park area was NEVER conducted.","Health"
"Could you please look into the issue that contaminated water is being supplied to households in the main market area? Please send someone to fix this soon.","Water Supply"
"This letter is to inform the department that burning of garbage near the industrial area is causing air pollution","Sanitation"
"My family is really struggling since the sanitation inside the hospital near MG Road is very poor. Please help us out.","Health"
"Sir just want to say there is a terrible smell coming from the drain near the main market area","Drainage"
"I am writing to report that loud music from a shop near our colony disturbs the whole neighbourhood","Police"
"could you please look into the issue that the public cleanliness near the apartment complex has deteriorated badly? hope to see quick action on this.","Sanitation"
"URGENT: there is a leaking valve near MG Road WASTING a lot of water. Hope to see quick action on this.","Water Supply"
"Could you please look into the issue that heavy rain caused the drain near the old town area to overflow into houses? This should have been fixed long ago","Drainage"
"It is so painful to see that there is a terrible smell coming from the drain near the industrial area. We need a permanent solution to this problem.","Drainage"
"the sewage pipeline near Gandhi Nagar has been leaking since last week. This has been a recurring issue in the area and is causing a lot of inconvenience to residents. Please help us out","Drainage"
"the road markings near the bridge area have faded COMPLETELY.","Roads"
"Guys please note a theft was reported near Shastri Nagar and no action has been taken. Hope to see quick action on this.","Police"
"We are   fed up as the transformer near our street is damaged and sparking since this afternoon. Please take strict action against those responsible.","Electricity"
"Just letting you know burning of garbage near the outskirts of the city is causing air pollution.","Sanitation"
"Sir/madam the bus stop near the flyover has been broken since the rains started. Please take strict action against those responsible.","Transport"
"Please act fast, we are FACING severe voltage fluctuation in our village. Please look into this matter as soon as possible.","Electricity"
"This is an emergency situation. the water pipe near the school area burst and is flooding the street. Waiting for a quick response from your side.","Water Supply"
"traffic congestion near the housing society has become unbearable.","Transport"
"Hi team, there is a terrible smell coming from the drain near the water tank area. Regards.","Drainage"
"Could you please look into the issue that stray dogs near the hospital in Gandhi Nagar are becoming a health hazard?","Health"
"the bus conductor near the residential block was rude to passengers. This has been a recurring issue in the area and is causing a lot of inconvenience to residents. Kindly resolve this issue at the earliest.","Transport"
"drains in the housing society are completely blocked with waste. This has been a recurring issue in the area and is causing a lot of inconvenience to residents. Thank you.","Drainage"
"I am writing to report that the traffic signal near the hospital area has been malfunctioning for the last month.","Transport"
"we suspect sewage is mixing with drinking water supply in the slum area.","Water Supply"
"It is so painful to see that the buses passing through the main market area are dangerously overcrowded.","Transport"
"Could you please look into the issue that a chain snatching incident occurred near the industrial area yesterday?","Police"
"the road divider near our block is   broken and dangerous for drivers. This has been a recurring issue in the area and is causing a lot of inconvenience to residents. Please help us out.","Roads"
"please act fast, the buses passing through the corner shop area are dangerously overcrowded. please look into this matter as soon as possible.","Transport"
"patients at the hospital near Ward 7 face very long waiting times.","Health"
"Just letting you know buses on the route through the school area are always late since Monday.","Transport"
"This is to formally inform you that the garbage truck has not visited the temple area for the last 5 days.","Sanitation"
"Could you please look into the issue that the traffic signal near the main market area has been malfunctioning for 2 weeks now?","Transport"
"We are suffering a lot becuase the water pressure in Model Town is extremely low. Hope to see quick action on this.","Water Supply"
"This is an emergency situation. we have received no water supply in the college road since last week. Requesting immediate action from your department.","Water Supply"
"could you please look into the issue that drains in the college road are completely blocked with waste? this should have been fixed long ago.","Drainage"
"Sir just want to say a theft was reported near the flyover and no action has been taken.","Police"
"hello, there are huge potholes on the road near the water tank area. thank you.","Roads"
"residents of our neighbourhood have not received drinking water since Monday. This has been a recurring issue in the area and is causing a lot of inconvenience to residents. Please send someone to fix this soon","Water Supply"
"could you please look into the issue that the water pressure in Shastri Nagar is extremely low? Thank you","Water Supply"
"We are fed up as auto rickshaw drivers near the main market area are overcharging passengers. Hope to see quick action on this","Transport"
"stret light poles in the water tank area are sparking at night. This has been a recurring issue in the area and is causing a lot of inconvenience to residents.","Electricity"
"Could you please look into the issue that a theft was reported near the outskirts of the city and no action has been taken?","Police"
"This letter is to inform the department that there is a leaking valve near the highway junction wasting a lot of water. Please take strict action against those responsible.","Water Supply"
"the government hospital near the railway station road is extremely unclean. This has been a recurring issue in the area and is causing a lot of inconvenience to residents. Regards.","Health"
"the ambulance service near the residential block took too long to respond since Monday. This has been a recurring issue in the area and is causing a lot of inconvenience to residents.","Health"
"Could you please look into the ISSUE that there is a terrible smell coming from the drain near Sector 12? Thank you.","Drainage"
"I am writing to report that the water tanker never arrives on time in our colony.","Water Supply"
"Please resolve this on priority basis. people are dumping waste illegally near the temple area. Thank you.","Sanitation"
"Could you please look into the issue that there is a shortage of medical staff at the clinic near the hospital area? Requesting immediate action from your department.","Health"
"This is to formally inform you that a theft was reported near the water tank area and no action has been taken. Regards.","Police"
"We are suffering a lot because the road divider near the industrial area is broken and dangerous for drivers. Regards.","Roads"
"the traffic signal near the bus stand area has been malfunctioning for several days.","Transport"
"Just letting you know street light poles in the railway station road   are sparking at night.","Electricity"
"I feel helpless because a chain snatching incident occurred near Model Town yesterday. Thank you","Police"
"This needs immediate attention. stray animals are scattering garbage all over the government quarters. Regards.","Sanitation"
"This is to formally inform you that the local train service near Sector 12 has been delayed for the last few months.","Transport"
"I am really frustrated that patients at the hospital near our lane face very long waiting times. PLEASE help us out.","Health"
"Sir/madam the electricity meter installed at the temple area seems to be faulty. We need a permanent solution to this problem.","Electricity"
"there is a terrible smell coming from the drain near Ward   7. This has been a recurring issue in the area and is causing a lot of inconvenience to residents. This should have been fixed long ago.","Drainage"
"sir/madam traffic violations are common near the corner shop area and no one is checking. Please help us out","Police"
"Could you please look into the issue that the transformer near the park area is damaged and sparking continuously since last night? This should have been fixed long ago.","Electricity"
"Could you please look into the issue that heavy rain caused the drain near the old town area to overflow into houses? Requesting immediate action from your department.","Drainage"
"Sir just want to say there is a leaking valve near MG Road wasting a lot of water. Please look into this matter as soon as possible.","Water Supply"
"a theft was reported near our street and no action has been taken.","Police"
"the street lights in Nehru Colony havent worked for the past 3 days.","Electricity"
"the road near the slum area has developed deep cracks. This has been a recurring issue in the area and is causing a lot of inconvenience to residents. Please look into this matter as soon as possible.","Roads"
"the transformer near Nehru Colony is damaged and sparking since Monday.","Electricity"
"loose electric wires are hanging near Gandhi Nagar, posing a safety risk. This has been a recurring issue in the area and is causing a lot of inconvenience to residents.","Electricity"
"I feel helpless because the footpath near the flyover is damaged making it hard for pedestrians. This should have been fixed long ago","Roads"
"My family is really struggling since there is a major water leakage near the water tank area continuously since last night. We need a permanent solution to this problem","Water Supply"
"Could you please look into the issue that the power supply to Gandhi Nagar KEEPS tripping every few hours? Thank you.","Electricity"
"stray dogs near the hospital in Gandhi Nagar are becoming a health hazard. This has been a recurring issue in the area and is causing a lot of inconvenience to residents. Regards.","Health"
"Could you please look into the issue that garbage has not been collected in the college road for over a week? Please take strict action against those responsible.","Sanitation"
"Immediate action required: the sewage pipeline near the local market has been leaking since last Sunday. Waiting for a quick response from your side.","Drainage"
"the road markings near Sector 12 have faded completely. This has been a recurring issue in the area and is causing a lot of inconvenience to residents. Hope to see quick action on this.","Roads"
"Could you please look into the issue that there has been no electricity supply in the local market since last Sunday?","Electricity"
"Could you please look into the issue that an electric pole near the bridge area is damaged and leaning dangerously? Kindly resolve this ISSUE at the earliest.","Electricity"
"I would like to bring to your attention that the dustbins near the local market are overflowing with waste.","Sanitation"
"illegal parking near the water tank area is blocking the road. This has been a recurring issue in the area and is causing a lot of inconvenience to residents. We need a permanent solution to this problem","Transport"
"I am really frustrated that the drainage cover near our NEIGHBOURHOOD is broken, its a safety hazard.","Drainage"
"i am really frustrated that residents of the main market area have not received drinking water for the past 3 days. Please help us out.","Water Supply"
"the borewell near Sector 12 has stopped working for the past few hours.","Water Supply"
"the footpath near our street is damaged making it hard for pedestrians.","Roads"
"the footpath near the corner shop area is damaged making it hard for pedestrians. this has been a recurring issue in the area and is causing a lot of inconvenience to residents. hope to see quick action on this.","Roads"
"Hello, there is a major water leakage near Ward 7 for the last few months. Waiting for a quick response from your side.","Water Supply"
"Could you please look into the issue that sewage is overflowing onto the stret near the hospital area? Kindly resolve this issue at the earliest.","Drainage"
"This letter is to inform   the department that a street fight broke out near the government quarters last night. Regards.","Police"
